{
  "analysis": {
    "all_history_count": 80,
    "finite_first_true_null_history_count": 46,
    "invalid_count": 0,
    "pathwise_invariant_violations": 0,
    "primary_holm_audit": {
      "adjusted_pvalues": {
        "B1_MAE_B02__0": 1.0,
        "B1_MAE_B02__1": 1.0,
        "B1_MAE_B02__2": 1.0,
        "B1_MAE_B02__3": 1.0,
        "B1_MAE_B02__4": 1.0,
        "B1_MAE_B02__5": 1.0,
        "B1_MAE_B02__6": 1.0,
        "B1_MAE_B02__7": 1.0,
        "B1_MAE_B05__0": 1.0,
        "B1_MAE_B05__1": 1.0,
        "B1_MAE_B05__2": 1.0,
        "B1_MAE_B05__3": 1.0,
        "B1_MAE_B05__4": 1.0,
        "B1_MAE_B05__5": 1.0,
        "B1_MAE_B05__6": 1.0,
        "B1_MAE_B05__7": 1.0,
        "B1_MAE_NEG__0": 1.0,
        "B1_MAE_NEG__1": 1.0,
        "B1_MAE_NEG__2": 1.0,
        "B1_MAE_NEG__3": 1.0,
        "B1_MAE_NEG__4": 1.0,
        "B1_MAE_NEG__5": 1.0,
        "B1_MAE_NEG__6": 1.0,
        "B1_MAE_NEG__7": 1.0,
        "QB_MSE_NEG__0": 1.0,
        "QB_MSE_NEG__1": 1.0,
        "QB_MSE_NEG__2": 1.0,
        "QB_MSE_NEG__3": 1.0,
        "QB_MSE_NEG__4": 1.0,
        "QB_MSE_NEG__5": 1.0,
        "QB_MSE_NEG__6": 1.0,
        "QB_MSE_NEG__7": 1.0,
        "QB_MSE_NOM02__0": 1.0,
        "QB_MSE_NOM02__1": 1.0,
        "QB_MSE_NOM02__2": 1.0,
        "QB_MSE_NOM02__3": 1.0,
        "QB_MSE_NOM02__4": 1.0,
        "QB_MSE_NOM02__5": 1.0,
        "QB_MSE_NOM02__6": 1.0,
        "QB_MSE_NOM02__7": 1.0,
        "QB_MSE_NOM05__1": 1.0,
        "QB_MSE_NOM05__3": 1.0,
        "QB_MSE_NOM05__4": 1.0,
        "QB_MSE_NOM05__5": 1.0,
        "QB_MSE_NOM05__6": 1.0,
        "QB_MSE_NOM05__7": 1.0
      },
      "family_alpha": 0.01,
      "family_size": 46,
      "rejected_history_ids": [],
      "status": "NO_CALIBRATION_RED_FLAG_OBSERVED"
    }
  },
  "claim_boundary": "implementation conformance within two frozen synthetic P-classes only",
  "h_freeze_manifest_sha256": "5229432f2384a80b2cde4097c68cf08e383cdacbf67642f8de12537895c0e8c9",
  "implementation_freeze_sha256": "0f9d5bb9e6b19a1cffa3e1fbe38d34054a0c2328a03f12ea56efe6bf35ca285c",
  "status": "CONFIRMATORY_IMPLEMENTATION_PASS",
  "study_id": "UBOA_ROUTE_B_SYNTH_CONFIRMATORY_V1"
}
